{
  "protocol": "1.0",
  "grant_id": "a0000000-0000-4000-8000-000000000001",
  "grant_sha256": "658d9e06be5a175228ddea952cfb63b408a75bd321e573a2d1549ddd3f66af36",
  "replay_request_id": "a0000000-0000-4000-8000-000000000003",
  "scope_sha256": "ae9c5447c8e3b1c05ab7cdb1cead8482230ebea55bc85b5c91330e15f8f15b67",
  "admitting_security_generation": "a0000000-0000-4000-8000-000000000002",
  "admitting_session_generation": 2,
  "admitting_collector_boot_id": "a0000000-0000-4000-8000-000000000004",
  "deployment_id": "00000000-0000-4000-8000-000000000001",
  "host_id": "00000000-0000-4000-8000-000000000002",
  "original_security_generation": "77777777-7777-4777-8777-777777777777",
  "original_collector_boot_id": "11111111-1111-4111-8111-111111111111",
  "frames": [
    {
      "original_source_id": "33333333-3333-4333-8333-333333333333",
      "original_sequence": 42,
      "original_observed_ms": 1789473600000,
      "original_payload_sha256": "8888888888888888888888888888888888888888888888888888888888888888",
      "frame": {
        "source_id": "33333333-3333-4333-8333-333333333333",
        "sequence": 42,
        "observed_wall_ms": 1789473600000,
        "estimated_utc_ms": 1789473600085,
        "offset_ms": 85,
        "uncertainty_ms": 4,
        "monotonic_start_ns": "100000000000",
        "monotonic_end_ns": "100016000000",
        "duration_ms": 16,
        "definition_revision": "mac-ollama-1",
        "incarnation_id": null,
        "quality": "measured",
        "provenance": {
          "source": "darwin_api",
          "method_revision": "darwin-host-candidate-1",
          "verification": "direct_capture",
          "observed_at_ms": 1789473600000,
          "source_artifact_sha256": null
        },
        "gauges": {
          "host.cpu.busy_ratio": {
            "value": 0.42,
            "quality": "measured",
            "missing_reason": null,
            "provenance": {
              "source": "darwin_api",
              "method_revision": "darwin-host-candidate-1",
              "verification": "direct_capture",
              "observed_at_ms": 1789473600000,
              "source_artifact_sha256": null
            }
          },
          "host.memory.pressure_level": {
            "value": "normal",
            "quality": "measured",
            "missing_reason": null,
            "provenance": {
              "source": "darwin_api",
              "method_revision": "darwin-host-candidate-1",
              "verification": "direct_capture",
              "observed_at_ms": 1789473600000,
              "source_artifact_sha256": null
            }
          },
          "host.memory.compressed_bytes": {
            "value": "2890000000",
            "quality": "measured",
            "missing_reason": null,
            "provenance": {
              "source": "darwin_api",
              "method_revision": "darwin-host-candidate-1",
              "verification": "direct_capture",
              "observed_at_ms": 1789473600000,
              "source_artifact_sha256": null
            }
          },
          "host.memory.swap_used_bytes": {
            "value": "2899181568",
            "quality": "measured",
            "missing_reason": null,
            "provenance": {
              "source": "darwin_api",
              "method_revision": "darwin-host-candidate-1",
              "verification": "direct_capture",
              "observed_at_ms": 1789473600000,
              "source_artifact_sha256": null
            }
          },
          "host.disk.free_bytes": {
            "value": "9007199254740993",
            "quality": "measured",
            "missing_reason": null,
            "provenance": {
              "source": "darwin_api",
              "method_revision": "darwin-host-candidate-1",
              "verification": "direct_capture",
              "observed_at_ms": 1789473600000,
              "source_artifact_sha256": null
            }
          }
        },
        "network_observations": [
          {
            "interface_id": "aaaaaaaaaaaaaaaaaaaaaaaaaaaaaaaaaaaaaaaaaaaaaaaaaaaaaaaaaaaaaaaa",
            "boot_id": "11111111-1111-4111-8111-111111111111",
            "counter_epoch_id": "55555555-5555-4555-8555-555555555555",
            "loopback": false,
            "received_bytes_total": "9007199254740993",
            "sent_bytes_total": "12",
            "missing": [],
            "provenance": {
              "source": "darwin_api",
              "method_revision": "net-rt-iflist2-candidate-1",
              "verification": "direct_capture"
            }
          }
        ],
        "model_observations": [],
        "process_observations": [
          {
            "host_id": "00000000-0000-4000-8000-000000000002",
            "boot_id": "11111111-1111-4111-8111-111111111111",
            "pid": 700,
            "process_start_identity": "100000000",
            "process_key": "bbbbbbbbbbbbbbbbbbbbbbbbbbbbbbbbbbbbbbbbbbbbbbbbbbbbbbbbbbbbbbbb",
            "display_basename": "ollama",
            "category": "selected_ollama",
            "target_id": "44444444-4444-4444-8444-444444444444",
            "association_quality": "verified",
            "cpu_busy_ratio": 0.1,
            "physical_footprint_bytes": "536870912",
            "missing": [],
            "provenance": {
              "source": "darwin_api",
              "method_revision": "darwin-proc-rusage-candidate-1",
              "verification": "direct_capture"
            }
          }
        ],
        "process_summary": {
          "eligible_pid_count": 100,
          "examined_pid_count": 100,
          "permission_denied_count": 2,
          "retained_process_count": 1,
          "enumeration_truncated": false,
          "coverage": "partial",
          "method_revision": "darwin-proc-rusage-candidate-1",
          "sample_interval_ms": 15000,
          "scan_duration_ms": 200
        },
        "capabilities_missing": [
          {
            "id": "gpu.busy_ratio",
            "reason": "unsupported_platform_contract",
            "detail_code": null
          }
        ]
      }
    }
  ]
}
